Key,Description,Standard,EN,ES
SAY.Flowchart.1.Barbara Pinault,,Mais c'est quoi ce bins mdr?,Yeezy yeezy what's good it's your boy Max B whats goin onnn,J'ai fait allemand LV2
SAY.Flowchart.2.,,Ohlala mais quelle panade j'avais réservé un table à la chicorée dans 45minutes,Ohlala yamete kudasai Machine-kun,Donde esta la skibidibap
SAY.Flowchart.3., ,C'est bien ma veine sérieux je suis furibonde mamaaaaaa,Unluckeeeh :(,Karim Mostefa Benzema es el Golden Fumier
CHARACTER.Barbara Pinault,,Barbara Pinault,,
CHARACTER.Character Name,,Character Name,,
